{
  "schemaVersion": 1,
  "scope": "_guidelines",
  "section": "tools",
  "nodes": [
    {
      "id": "_guidelines/tools",
      "sid": "s-qtq7t32yfqj2yzw",
      "kind": "section",
      "title": "The tools",
      "status": "checked",
      "text": "How SpecSheriff's own toolset carries out the base of the guidelines.",
      "refs": [],
      "children": [
        {
          "id": "_guidelines/tools/1",
          "sid": "s-zefk589ykh37b8u",
          "kind": "rule",
          "title": "Where the files are",
          "status": "checked",
          "text": "Each domain of the specification is kept under `specs/<domain>/`, opening with its head in `specs/<domain>/00-<domain>.json`, contracts under `specs/contracts/`, the technical appendix under `specs/tech/`, each of its sections in a file of its own — a domain's in `<domain>.json`, the stack's in `stack.json`, the technical debt's in `debt.json` — and the guidelines under `specs/_guidelines/`: the base in `spec.json`, the appendix of the tools in `tools.json`, and a project's own guidelines in `project.json`. A part divided into one file per section keeps its files in its directory. The schema is kept in `specs/_schema/`: `node.schema.json` for a node and its metadata, `section-file.schema.json` for the file of a part. Confirmations are kept in `specs/_confirmations.jsonl`, the archive of removed nodes in `specs/_archive/<name>.json`. `specs/_viewer/` (the map) and `md-version/` (the readable export) are rebuilt after every change to the specification and not stored in git; the skills `sheriff skill` writes are kept in git, where the agent's harness reads them. The toolset is installed as the npm package `specsheriff`, which provides the command `sheriff`, and its plugin for pytest as the package `pytest-specsheriff`. The toolset's settings are kept in `sheriff.config.json` at the root of the repository. Among them, glob patterns name where the system's code lives and where its tests live: the code is read for tags, the tests for the sids they declare, and a file neither names for neither — which is how the repository's tools, its configuration and its tests are exempt from tags by where they live. The repository the core is written in says so by the setting `\"writesCore\": true`. The specification's owner is the one the top node of `project.json` names, and the levels its domains stand at are the members of the list carried by the rule of `project.json` that refines §s-nkyty4dy9x2v2a4.",
          "refs": [
            {
              "type": "implements",
              "to": "s-k73czmpkazcx7mu"
            },
            {
              "type": "implements",
              "to": "s-eferktypcj7njt5"
            },
            {
              "type": "implements",
              "to": "s-f2b5zvc565s242f"
            },
            {
              "type": "implements",
              "to": "s-a4rbry4hsu34hy8"
            },
            {
              "type": "implements",
              "to": "s-67vekyup7y8smap"
            },
            {
              "type": "implements",
              "to": "s-nkyty4dy9x2v2a4"
            }
          ]
        },
        {
          "id": "_guidelines/tools/2",
          "sid": "s-f5rz6b7dhxejjts",
          "kind": "rule",
          "title": "The commands",
          "status": "checked",
          "text": "`sheriff validate` runs the checks of the specification on its own, and `sheriff binding` those between the specification and the code, the drift report with them; `sheriff citations` checks the citations outside the specification; `sheriff message` grades a commit message against the file git hands a commit-msg hook, and `sheriff review` asks the reviewer for its verdict on the commit being made. `sheriff reindex` gives a sid to every node that has none, computes every node's address from where it stands, empties every incoming list and rebuilds it from the outgoing ones, rebuilds the index in every domain's head from the domain's sections, and empties the status of every checked node outside the core the project takes unless the latest line for its wording's fingerprint is a confirmation by the node's owner; it is run after every change to the specification. Before anything else, `sheriff reindex` merges, in every file it rewrites, the values an object holds under one key, each into those written before it: two lists into one holding the members of the first and then those of the second that the first does not hold, two objects key by key in the same way with each key where it was first written, and two values JSON Schema holds equal into one. It names every key it merged, with the file and each value's line, and refuses any other two, naming the file, the key and each one's line and value, and then writes no file. `sheriff confirm` records an owner's confirmation (§s-v4qus7raqnwzneb). `sheriff guard` judges an edit an agent is about to make. `sheriff export` writes the readable export in markdown, `sheriff render` the map, and `sheriff skill` the skills generated from the guidelines. `sheriff show` prints a node, found by its sid or its address: its address, title, status, text and reason, and every link it makes or receives, named by the address and title of the node at the other end. `sheriff types` generates, from the record nodes, the types and the runtime checks of the system's code, where the technical appendix says they stand.",
          "refs": [
            {
              "type": "implements",
              "to": "s-83ev4wwesbwnhnp"
            },
            {
              "type": "implements",
              "to": "s-jau82aq9juv9zzh"
            },
            {
              "type": "implements",
              "to": "s-jsqxdx47wkkj7gp"
            },
            {
              "type": "implements",
              "to": "s-bpdqd9v72wg7vsz"
            },
            {
              "type": "implements",
              "to": "s-kh8qcd5kxgh9z3j"
            },
            {
              "type": "implements",
              "to": "s-e877bnfa559tvk9"
            },
            {
              "type": "cites",
              "to": "s-v4qus7raqnwzneb"
            },
            {
              "type": "implements",
              "to": "s-5ah25f6gy99panq"
            },
            {
              "type": "cites",
              "to": "s-hr7j7scmfkkjnws"
            }
          ],
          "rationale": "The reindex rewrites whole the files written by hand, so it keeps everything they hold: two values written under one key are each somebody's intent, kept together where both can stand and refused where keeping one would drop the other, since nothing says which was meant; and every merge is named, because one of them may have been written to replace the other.",
          "meta": {
            "decisions": [
              {
                "date": "2026-10-07",
                "problem": "The types and runtime checks generated from the record nodes had no command.",
                "ruling": "The owner: a command of their own generates them.",
                "type": "textual"
              },
              {
                "date": "2026-10-21",
                "problem": "The reindex read every file through a parser that keeps the last of two values under one key and drops the first, and wrote back what it read: a ruling written under a second decisions key of a node's metadata hid two earlier rulings on the same rule from every tool, and the next reindex would have deleted them.",
                "ruling": "The owner: the reindex merges the two values, names each merge, and refuses two it cannot merge, naming both.",
                "type": "textual"
              },
              {
                "date": "2026-10-26",
                "problem": "A command reported a citation as a candidate for a link nobody typed, and the citation check, which a commit runs, was named by no rule.",
                "ruling": "Following the owner's rulings on citations (§s-bpdqd9v72wg7vsz, §s-hr7j7scmfkkjnws): the command reporting candidates goes, and the citation check is named among the commands.",
                "type": "textual"
              },
              {
                "date": "2026-10-27",
                "problem": "The commands were one repository's package scripts.",
                "ruling": "The owner: they are the commands of SpecSheriff's toolset, described in the appendix of the tools.",
                "type": "textual"
              }
            ]
          }
        },
        {
          "id": "_guidelines/tools/3",
          "sid": "s-rpv4fkdqqguptqd",
          "kind": "rule",
          "title": "Building the map",
          "status": "checked",
          "text": "`sheriff render` reads the nodes and writes into `specs/_viewer/` a web page that draws the map from them. The web page draws it with markmap, from an outline in markdown that the command builds and keeps nowhere. Nothing is written by hand at any step: the map is regenerated from the nodes exactly as the readable export is.",
          "refs": [
            {
              "type": "implements",
              "to": "s-zu8ne3wq84zchc4"
            }
          ],
          "rationale": "The nodes are already a structure any drawing tool can read, so the map keeps no format of its own between them and the web page: a kept format would be a second copy of the structure, and one that keeps only titles and nesting, dropping the sids, status and links that anything shown on top of the map would be bound to.",
          "meta": {
            "decisions": [
              {
                "date": "2026-10-10",
                "problem": "The rule called the file the command writes a page, a word a project may keep for a page of its own user interface.",
                "ruling": "The owner: it is a web page, and the rule says so.",
                "type": "textual"
              }
            ]
          }
        },
        {